{
  "contractVersion": "2.0.0-alpha.1",
  "schemaId": "recognition-v2-topology-golden-case.schema.json",
  "caseId": "wsss-rnp02l-akoma-holding",
  "category": "HOLDING",
  "airportIcao": "WSSS",
  "procedureName": "RNP RWY 02L",
  "procedureType": "APPROACH",
  "source": {
    "publisher": "Civil Aviation Authority Singapore",
    "fileName": "File_AD-2-WSSS.pdf",
    "documentSha256": "696482bb2aaf173c1ff558ca2b90265a65ce18f416f3ed24c6df6b08d9c56787",
    "relativePath": "server/data/uploads/1784184509019-File_AD-2-WSSS.pdf",
    "reviewedAt": "2026-07-16T08:00:00.000Z",
    "pages": [
      {
        "pageNo": 254,
        "aipPageNo": "AD-2-WSSS-IAC-9",
        "role": "PROCEDURE_DIAGRAM",
        "evidence": [
          {
            "evidenceId": "ev_wsss_akoma_hold_text",
            "modality": "PRINTED_TEXT",
            "rawText": "TURN LEFT TO AKOMA TO JOIN THE HOLDING AT 4000FT OR ABOVE OR AS DIRECTED BY ATC."
          },
          {
            "evidenceId": "ev_wsss_akoma_hold_geometry",
            "modality": "VISUAL_GEOMETRY",
            "rawText": "AKOMA | 176° / 356° | MNM ALT 4000 | Max 220kts (IAS) | 1 Min",
            "reviewedObservation": "The missed-approach inset prints a left-turn racetrack at AKOMA, inbound 176 degrees and outbound 356 degrees."
          }
        ]
      }
    ]
  },
  "expectations": {
    "nodes": [
      { "identifier": "AKOMA", "nodeType": "FIX", "evidenceIds": ["ev_wsss_akoma_hold_text", "ev_wsss_akoma_hold_geometry"] }
    ],
    "edges": [
      {
        "edgeId": "edge_akoma_hold",
        "fromIdentifier": "AKOMA",
        "toIdentifier": "AKOMA",
        "relation": "HOLD",
        "pathTerminator": "HM",
        "turnDirection": "L",
        "inboundCourseDeg": 176,
        "outboundCourseDeg": 356,
        "legTimeMinutes": 1,
        "minimumAltitudeFt": 4000,
        "evidenceIds": ["ev_wsss_akoma_hold_text", "ev_wsss_akoma_hold_geometry"]
      }
    ],
    "branchPoints": [],
    "mergePoints": [],
    "requiredUnknowns": []
  }
}
