{
  "contractVersion": "2.0.0-alpha.1",
  "schemaId": "recognition-v2-topology-golden-case.schema.json",
  "caseId": "wmkj-adlov1g-dme-arc",
  "category": "DME_ARC",
  "airportIcao": "WMKJ",
  "procedureName": "ADLOV 1G / EMTUV 1G / PIMOK 1G / OMKOM 1G",
  "procedureType": "STAR",
  "source": {
    "publisher": "Civil Aviation Authority of Malaysia",
    "fileName": "1-WM-AD-2.WMKJ-en-MS-202607.pdf",
    "documentSha256": "0af784523c11d815ac5a89fc9d16ff3f4c6bdc389f76855bba3dfb5773c7dd0b",
    "relativePath": "server/data/aip-procedure-agent/6051d4a9-c2a2-422c-8907-6a4b373e1db7/evaluation-input/1-WM-AD-2.WMKJ-en-MS-202607.pdf",
    "reviewedAt": "2026-07-16T08:00:00.000Z",
    "pages": [
      {
        "pageNo": 1,
        "aipPageNo": "AD 2-WMKJ-7-5",
        "role": "PROCEDURE_DIAGRAM",
        "evidence": [
          {
            "evidenceId": "ev_wmkj_dme_title",
            "modality": "PRINTED_TEXT",
            "rawText": "ARRIVAL (11 DME ARC) RWY 16"
          },
          {
            "evidenceId": "ev_wmkj_dme_geometry",
            "modality": "VISUAL_GEOMETRY",
            "rawText": "11 DME ARC VJB VOR/DME",
            "reviewedObservation": "The published circle is centered on VJB; ADLOV, EMTUV, PIMOK and OMKOM join it at distinct VJB radials and continue toward RDL340 VJB."
          }
        ]
      },
      {
        "pageNo": 2,
        "aipPageNo": "AD 2-WMKJ-7-6",
        "role": "PROCEDURE_LEG_TABLE",
        "evidence": [
          {
            "evidenceId": "ev_wmkj_dme_adlov",
            "modality": "TABULAR_ROW",
            "rawText": "ADLOV ONE GOLF ARRIVAL (ADLOV 1G): ARRIVAL VIA A224 TO ADLOV, THEN TRACK INBOUND ON RDL-016 VJB VOR (TR 196°), AT 13 DME VJB VOR TURN RIGHT TO JOIN 11 DME ARC VJB VOR, THEN TURN LEFT TO INTERCEPT RDL-340 VJB VOR FOR STRAIGHT-IN APPROACH RUNWAY 16."
          },
          {
            "evidenceId": "ev_wmkj_dme_other_transitions",
            "modality": "TABULAR_ROW",
            "rawText": "OMKOM 1G, PIMOK 1G and EMTUV 1G each join the published 11 DME ARC VJB and then intercept RDL-340 VJB for RWY 16."
          }
        ]
      }
    ]
  },
  "expectations": {
    "nodes": [
      { "identifier": "ADLOV", "nodeType": "FIX", "evidenceIds": ["ev_wmkj_dme_adlov"] },
      { "identifier": "EMTUV", "nodeType": "FIX", "evidenceIds": ["ev_wmkj_dme_other_transitions"] },
      { "identifier": "PIMOK", "nodeType": "FIX", "evidenceIds": ["ev_wmkj_dme_other_transitions"] },
      { "identifier": "OMKOM", "nodeType": "FIX", "evidenceIds": ["ev_wmkj_dme_other_transitions"] },
      { "identifier": "VJB", "nodeType": "NAVAID", "evidenceIds": ["ev_wmkj_dme_geometry"] },
      { "identifier": "RDL340_11DME_VJB", "nodeType": "PSEUDO", "evidenceIds": ["ev_wmkj_dme_adlov", "ev_wmkj_dme_geometry"] }
    ],
    "edges": [
      {
        "edgeId": "edge_adlov_arc_exit",
        "fromIdentifier": "RDL016_11DME_VJB",
        "toIdentifier": "RDL340_11DME_VJB",
        "relation": "ARC",
        "pathTerminator": "AF",
        "turnDirection": "L",
        "centerIdentifier": "VJB",
        "radiusNm": 11,
        "evidenceIds": ["ev_wmkj_dme_adlov", "ev_wmkj_dme_geometry"]
      },
      {
        "edgeId": "edge_emtuv_arc_exit",
        "fromIdentifier": "RDL275_11DME_VJB",
        "toIdentifier": "RDL340_11DME_VJB",
        "relation": "ARC",
        "pathTerminator": "AF",
        "turnDirection": "R",
        "centerIdentifier": "VJB",
        "radiusNm": 11,
        "evidenceIds": ["ev_wmkj_dme_other_transitions", "ev_wmkj_dme_geometry"]
      }
    ],
    "branchPoints": [],
    "mergePoints": [],
    "requiredUnknowns": []
  }
}
